{"version":1,"date":"2026-09-19","generatedAt":"2026-09-19T18:46:40.133Z","prices":{"S12a-211":{"source":"cardmarket/tcgdex","currency":"EUR","updated":"2026-09-18T22:54:57.903Z","avg30":73.8,"avg7":73.92,"avg1":80.95,"trend":72.63,"low":35,"avg":74.45},"S12a-212":{"source":"cardmarket/tcgdex","currency":"EUR","updated":"2026-09-18T22:54:57.903Z","avg30":109.69,"avg7":81.3,"avg1":84,"trend":75.99,"low":68,"avg":106.47},"S12a-213":{"source":"cardmarket/tcgdex","currency":"EUR","updated":"2026-09-18T22:54:32.464Z","avg30":36.05,"avg7":34.35,"avg1":31.89,"trend":38.43,"low":15,"avg":36.17},"S12a-215":{"source":"cardmarket/tcgdex","currency":"EUR","updated":"2026-09-18T22:54:32.524Z","avg30":49.65,"avg7":46.16,"avg1":42,"trend":48.64,"low":29,"avg":50.09},"S12a-218":{"source":"cardmarket/tcgdex","currency":"EUR","updated":"2026-09-18T22:54:32.490Z","avg30":37.77,"avg7":42.27,"avg1":34.89,"trend":45.98,"low":24,"avg":37.86},"S12a-221":{"source":"cardmarket/tcgdex","currency":"EUR","updated":"2026-09-18T22:54:32.515Z","avg30":118.33,"avg7":109.06,"avg1":98.25,"trend":118.92,"low":89.49,"avg":120.54},"S12a-228":{"source":"cardmarket/tcgdex","currency":"EUR","updated":"2026-09-18T22:54:32.524Z","avg30":50.08,"avg7":43.9,"avg1":40.99,"trend":44.87,"low":38,"avg":50.22},"S12a-233":{"source":"cardmarket/tcgdex","currency":"EUR","updated":"2026-09-18T22:54:32.524Z","avg30":12.5,"avg7":12.08,"avg1":13,"trend":12.32,"low":9.98,"avg":12.42},"S12a-234":{"source":"cardmarket/tcgdex","currency":"EUR","updated":"2026-09-18T22:54:57.892Z","avg30":31.95,"avg7":29.47,"avg1":26.89,"trend":32.05,"low":25.95,"avg":32.17},"S12a-259":{"source":"cardmarket/tcgdex","currency":"EUR","updated":"2026-09-18T22:54:57.903Z","avg30":110.4,"avg7":102.2,"avg1":126.55,"trend":95.91,"low":74.99,"avg":111.28},"S12a-260":{"source":"cardmarket/tcgdex","currency":"EUR","updated":"2026-09-18T22:54:57.897Z","avg30":117.08,"avg7":105.89,"avg1":167.5,"trend":109.73,"low":84.95,"avg":116.52},"S12a-261":{"source":"cardmarket/tcgdex","currency":"EUR","updated":"2026-09-18T22:54:57.897Z","avg30":252.58,"avg7":241.53,"avg1":248.95,"trend":309.81,"low":148,"avg":247.15},"S12a-262":{"source":"cardmarket/tcgdex","currency":"EUR","updated":"2026-09-18T22:54:57.897Z","avg30":158.21,"avg7":146.73,"avg1":185,"trend":167.6,"low":99.99,"avg":158.2},"S8b-195":{"source":"cardmarket/tcgdex","currency":"EUR","updated":"2026-09-18T22:54:32.524Z","avg30":14.6,"avg7":14.47,"avg1":13.98,"trend":11.96,"low":10,"avg":14.9},"SV1a-080":{"source":"cardmarket/tcgdex","currency":"EUR","updated":"2026-09-18T22:54:57.903Z","avg30":167.74,"avg7":167.22,"avg1":135,"trend":142.98,"low":82.49,"avg":167.34},"SV1S-083":{"source":"cardmarket/tcgdex","currency":"EUR","updated":"2026-09-18T22:54:57.897Z","avg30":11.17,"avg7":11.28,"avg1":11.34,"trend":11.4,"low":9.25,"avg":11.06},"SV1S-084":{"source":"cardmarket/tcgdex","currency":"EUR","updated":"2026-09-18T22:54:32.490Z","avg30":11.82,"avg7":14.4,"avg1":11.13,"trend":13.38,"low":9.8,"avg":11.92},"SV1S-101":{"source":"cardmarket/tcgdex","currency":"EUR","updated":"2026-09-18T22:54:32.503Z","avg30":158.27,"avg7":174.43,"avg1":150,"trend":164.39,"low":85,"avg":177.13},"SV1V-086":{"source":"cardmarket/tcgdex","currency":"EUR","updated":"2026-09-18T22:54:57.897Z","avg30":18.26,"avg7":19.66,"avg1":16,"trend":18.11,"low":10.5,"avg":18},"SV2a-166":{"source":"cardmarket/tcgdex","currency":"EUR","updated":"2026-09-18T22:54:32.524Z","avg30":21.4,"avg7":21.19,"avg1":22.54,"trend":21.65,"low":13,"avg":21.65},"SV2a-167":{"source":"cardmarket/tcgdex","currency":"EUR","updated":"2026-09-18T22:54:32.524Z","avg30":15.56,"avg7":15.1,"avg1":14.78,"trend":13.25,"low":7.99,"avg":15.51},"SV2a-168":{"source":"cardmarket/tcgdex","currency":"EUR","updated":"2026-09-18T22:54:32.490Z","avg30":30.22,"avg7":31.14,"avg1":24.5,"trend":26.63,"low":19,"avg":30.63},"SV2a-169":{"source":"cardmarket/tcgdex","currency":"EUR","updated":"2026-09-18T22:54:32.490Z","avg30":18.58,"avg7":17.55,"avg1":15.6,"trend":17.61,"low":11.43,"avg":19.58},"SV2a-170":{"source":"cardmarket/tcgdex","currency":"EUR","updated":"2026-09-18T22:54:57.903Z","avg30":28.01,"avg7":25.08,"avg1":19.99,"trend":23.55,"low":18,"avg":27.85},"SV2a-171":{"source":"cardmarket/tcgdex","currency":"EUR","updated":"2026-09-18T22:54:32.490Z","avg30":15.53,"avg7":15.71,"avg1":12.3,"trend":15.41,"low":9,"avg":16.1},"SV2a-182":{"source":"cardmarket/tcgdex","currency":"EUR","updated":"2026-09-18T22:54:32.524Z","avg30":14.12,"avg7":14.41,"avg1":14.28,"trend":13.95,"low":11.49,"avg":14.67},"SV2a-183":{"source":"cardmarket/tcgdex","currency":"EUR","updated":"2026-09-18T22:54:32.508Z","avg30":28.69,"avg7":27.86,"avg1":24.53,"trend":26.55,"low":19,"avg":31.22},"SV2a-200":{"source":"cardmarket/tcgdex","currency":"EUR","updated":"2026-09-18T22:54:32.503Z","avg30":128.25,"avg7":114.75,"avg1":80.98,"trend":120,"low":90,"avg":133.41},"SV2a-201":{"source":"cardmarket/tcgdex","currency":"EUR","updated":"2026-09-18T22:54:57.897Z","avg30":399.08,"avg7":353.37,"avg1":375,"trend":390.85,"low":240,"avg":417.82},"SV2a-202":{"source":"cardmarket/tcgdex","currency":"EUR","updated":"2026-09-18T22:54:57.897Z","avg30":145.77,"avg7":141.15,"avg1":104.99,"trend":140.81,"low":90,"avg":148},"SV2a-203":{"source":"cardmarket/tcgdex","currency":"EUR","updated":"2026-09-18T22:54:32.508Z","avg30":62.77,"avg7":63.4,"avg1":46.67,"trend":58.52,"low":45,"avg":62.37},"SV2D-092":{"source":"cardmarket/tcgdex","currency":"EUR","updated":"2026-09-18T22:54:57.923Z","avg30":37.21,"avg7":40.33,"avg1":39.99,"trend":55.83,"low":35,"avg":38.49},"SV2P-077":{"source":"cardmarket/tcgdex","currency":"EUR","updated":"2026-09-18T22:54:32.490Z","avg30":8.4,"avg7":9.68,"avg1":8.23,"trend":11.27,"low":6.49,"avg":8.32},"SV3-110":{"source":"cardmarket/tcgdex","currency":"EUR","updated":"2026-09-18T22:54:32.490Z","avg30":15.61,"avg7":14.46,"avg1":13.61,"trend":14.82,"low":8.99,"avg":16.49},"SV3a-069":{"source":"cardmarket/tcgdex","currency":"EUR","updated":"2026-09-18T22:54:32.490Z","avg30":34.16,"avg7":28.64,"avg1":26.79,"trend":35.89,"low":12,"avg":38.75},"SV4a-339":{"source":"cardmarket/tcgdex","currency":"EUR","updated":"2026-09-18T22:54:32.508Z","avg30":3.25,"avg7":2.16,"avg1":2.5,"trend":2.89,"low":0.99,"avg":3.32},"SV5M-073":{"source":"cardmarket/tcgdex","currency":"EUR","updated":"2026-09-18T22:54:57.897Z","avg30":13.93,"avg7":13.4,"avg1":12.98,"trend":15.46,"low":9.99,"avg":13.94},"SV5M-074":{"source":"cardmarket/tcgdex","currency":"EUR","updated":"2026-09-18T22:54:57.897Z","avg30":10.9,"avg7":10.97,"avg1":10,"trend":10.7,"low":7,"avg":10.87},"SV6-104":{"source":"cardmarket/tcgdex","currency":"EUR","updated":"2026-09-18T22:54:57.903Z","avg30":3.67,"avg7":3.26,"avg1":2.98,"trend":2.81,"low":2.4,"avg":3.68},"SV7a-070":{"source":"cardmarket/tcgdex","currency":"EUR","updated":"2026-09-18T22:54:57.897Z","avg30":15.83,"avg7":14.53,"avg1":13.25,"trend":15.71,"low":3.5,"avg":16.64},"SV7a-073":{"source":"cardmarket/tcgdex","currency":"EUR","updated":"2026-09-18T22:54:57.804Z","avg30":3.19,"avg7":4.02,"avg1":3,"trend":3.69,"low":1.7,"avg":2.96},"SV9-102":{"source":"cardmarket/tcgdex","currency":"EUR","updated":"2026-09-18T22:54:32.524Z","avg30":10.81,"avg7":9.94,"avg1":9.67,"trend":8.6,"low":6.98,"avg":11.58},"SV9-109":{"source":"cardmarket/tcgdex","currency":"EUR","updated":"2026-09-18T22:54:57.923Z","avg30":15.67,"avg7":17.2,"avg1":18.18,"trend":15.36,"low":11,"avg":15.25},"CLK-001":{"source":"cardmarket/manual","currency":"EUR","updated":"2026-09-19","avg30":19.53,"avg7":null,"avg1":null,"trend":20.64,"low":10,"avg":null},"PMCG1-001":{"source":"cardmarket/manual","currency":"EUR","updated":"2026-09-19","avg30":5.3,"avg7":null,"avg1":null,"trend":2.55,"low":0.34,"avg":null},"PMCG1-014":{"source":"cardmarket/manual","currency":"EUR","updated":"2026-09-19","avg30":12.32,"avg7":null,"avg1":null,"trend":4.7,"low":0.45,"avg":null}}}
